recorded,question,answer
0,"If you could encourage others to take up a hobby for relaxation and stress relief, what advice would you give them? What would you want them to know about the importance of hobbies in your life?",-
0,"How do you define creativity, and what does it mean to you personally? How does it manifest in your daily life?",-
0,Can you describe a time when you felt particularly creative or innovative? What conditions or influences sparked that creativity?,-
0,How do you balance the need for structure and planning with the freedom to be creative? Has this balance changed over time?,-
0,What role does failure or the fear of failure play in your creative process? How do you handle setbacks or mistakes in a creative project?,-
0,"How do you cultivate creativity in your work or personal life? Are there specific practices, environments, or tools that you find especially inspiring?",-
0,How do you view the relationship between creativity and collaboration? Can you share an example of a collaborative project that led to innovative results?,-
0,How do you respond to criticism or feedback about your creative work? How has this feedback shaped your creative process or end product?,-
0,How does creativity connect to your values or your sense of purpose? Does your creative expression reflect a deeper personal or philosophical belief?,-
0,What are the barriers or obstacles to creativity that you have faced? How have you overcome them or adapted to them?,-
0,How do you see the role of creativity and innovation in addressing societal challenges or creating positive change in the world?,-
0,"How do you view the tension between originality and convention? Have you ever felt pressured to conform, and how did you navigate that pressure?",-
0,"Who or what are your creative influences? How have they shaped your thinking, and how do you ensure that your work remains unique and authentic?",-
0,"How does your creative process differ when you are working on something purely for yourself versus something for others (e.g., a client or audience)?",-
0,"Do you believe creativity can be taught or nurtured? If so, what advice would you give to someone looking to boost their creativity or innovation skills?",-
0,"How do you envision the future of creativity and innovation in your field or area of interest? What trends or changes do you anticipate, and how are you preparing for them?",-
0,"How do you choose the creative hobbies you engage in? What draws you to them, and what personal needs or desires do they fulfill?",-
0,"Can you describe a particular project or creation that you're especially proud of? What challenges did you face, and how did you overcome them?",-
0,How do you approach learning a new creative skill or hobby? What's your process for developing and honing that skill?,-
0,How have your creative hobbies and skills influenced your understanding of yourself? Have they revealed any hidden aspects of your personality?,-
0,"Have you ever shared or taught your creative hobbies to others? What was that experience like, and what did you learn from it?",-
0,"How do you balance your creative pursuits with other responsibilities in life? Have you ever faced conflicts between them, and how did you resolve them?",-
0,What role does experimentation and risk-taking play in your creative hobbies? How do you handle failure or mistakes in this context?,-
0,"How do your creative hobbies connect to your cultural background, upbringing, or personal beliefs? Is there a deeper significance to them that others might not see?",-
0,How have your creative hobbies evolved over time? Have changes in your life or personal growth been reflected in the way you approach creativity?,-
0,Do you find that your creative hobbies influence or are influenced by your professional life or other areas of expertise? How do they interact?,-
0,"How do you find inspiration for your creative work? Are there specific sources, environments, or practices that spark your creativity?",-
0,What emotional or mental states do you experience when engaging in your creative hobbies? How do they impact your well-being or stress levels?,-
0,How do you deal with creative blocks or lack of motivation in your hobbies? What strategies have you developed to overcome these challenges?,-
0,Have you ever considered turning your creative hobbies into a profession or business? Why or why not? How would that change your relationship with them?,-
0,"Looking into the future, how do you see your creative hobbies and skills evolving? Are there new areas you want to explore, and how will you approach them?",-
0,How do you approach the process of generating innovative ideas? What methods or tools do you employ to think outside the box?,-
0,"Can you describe an innovative idea or perspective that you've developed, and explain the problem it was designed to solve? How did it evolve from concept to implementation?",-
0,How do you cultivate a mindset that fosters creativity and innovation? Are there specific practices or environments that help you tap into this mindset?,-
0,"How do you navigate the balance between following established paths and breaking new ground? When do you decide to challenge conventional wisdom, and why?",-
0,How do you approach collaboration when working on innovative ideas? How do you ensure a diversity of perspectives and prevent groupthink?,-
0,How do you handle failure or setbacks when working on innovative projects? What lessons have you learned from those experiences?,-
0,What role do ethics and social responsibility play in your approach to innovation? How do you ensure that your ideas align with your values and the greater good?,-
0,How do your personal beliefs and cultural background influence your perspective on innovation? Are there any specific principles that guide your approach?,-
0,"How do you assess the potential impact of an innovative idea? What factors do you consider when determining its feasibility, scalability, and sustainability?",-
0,How do you stay informed and inspired by cutting-edge developments in your field or other areas that might influence your innovative thinking?,-
0,How do you approach resistance or skepticism when presenting innovative ideas to others? What strategies do you use to build support and overcome objections?,-
0,How has your approach to innovation changed over time? Can you point to specific experiences or insights that have shaped your thinking?,-
0,"How do you measure the success of an innovative idea or project? Is it solely about the end result, or are there other factors you consider?",-
0,What do you see as the biggest challenges and opportunities for innovation in today's world? How are you positioning yourself to address them?,-
0,"If you could give advice to someone striving to think more innovatively, based on your personal experiences and beliefs, what would it be?",-
0,How do you typically approach a new or complex problem? Can you describe the process or methods you use to break it down and find solutions?,-
0,Can you share an example of a particularly challenging problem you faced and how you resolved it? What did you learn from that experience?,-
0,How do you handle situations where a problem seems insurmountable or solutions are not readily apparent? What strategies do you employ to push through uncertainty?,-
0,How do you balance analytical thinking with creativity and intuition when solving problems? How do you know when to apply one approach over the other?,-
0,How do you assess the potential risks and outcomes of different solutions to a problem? What criteria do you use to choose the best course of action?,-
0,"How do you collaborate with others when problem-solving? What role does teamwork play in your approach, and how do you manage different perspectives and ideas?",-
0,"How do you handle failure or setbacks in problem-solving? How do you learn from those experiences, and how do they influence your future approach?",-
0,How do your personal values and ethics influence the way you approach problem-solving? Are there principles that guide your decision-making?,-
0,How do you ensure that your problem-solving strategies are aligned with broader goals or the bigger picture? How do you avoid getting lost in the details?,-
0,"How do you stay informed about new tools, techniques, or methodologies in problem-solving? How do you decide when to incorporate them into your approach?",-
0,How do you approach problems that require long-term solutions and ongoing effort? How do you maintain focus and momentum over time?,-
0,How do your problem-solving skills extend to your personal life or relationships? Can you provide an example of how you applied these skills outside of a professional context?,-
0,"How have your problem-solving skills evolved over time? What experiences, mentors, or insights have shaped your growth in this area?",-
0,What challenges do you see in teaching or fostering problem-solving skills in others? How would you approach helping someone else develop these abilities?,-
0,"If you could identify one key attribute or skill that is most critical to effective problem-solving, what would it be and why?",-
0,"How have your upbringing, culture, and personal experiences shaped your political and societal beliefs? Can you describe any pivotal moments that influenced your views?",-
0,What are the core values or principles that guide your political thinking? How do they align with or differ from the political ideologies you identify with?,-
0,How do you approach political or societal issues that you feel conflicted about or where your views may differ from those close to you?,-
0,"How do you stay informed about political and societal issues? What sources do you trust, and how do you assess the reliability and bias of information?",-
0,Can you describe a political or societal issue that you feel particularly passionate about? What actions have you taken or would like to take to address it?,-
0,How do you view the role of compromise and bipartisanship in politics? Can you provide examples where you've seen them work effectively or not?,-
0,How do you approach conversations with people who hold opposing political views? What strategies do you use to foster understanding and dialogue?,-
0,How do you view the relationship between individual rights and societal responsibilities? How do you balance these concepts in your own thinking?,-
0,How have your political and societal views evolved over time? What factors have contributed to those changes?,-
0,"How do you view the role of government in society? What responsibilities do you believe it should have, and where do you think it should limit its influence?",-
0,"How do you view the intersection of politics with other areas such as economics, education, healthcare, and the environment?",-
0,How do you engage with political and societal issues at the local versus national or global levels? How do you see your role as a citizen in these contexts?,-
0,"How do you approach ethical dilemmas in politics, such as the trade-offs between security and privacy or economic growth and environmental protection?",-
0,What do you see as the greatest challenges and opportunities for your society in the coming years? How do you envision contributing to addressing them?,-
0,"How do you envision the ideal society, and what political systems or structures do you believe would best achieve that vision?",-
0,"How would you describe your political beliefs, and how have they evolved over time? Are there key experiences or influences that have shaped them?",-
0,"What values or principles are most important to you in politics, and how do they align with your chosen political affiliations?",-
0,How do you reconcile differences between your personal beliefs and the positions or actions of the political parties or leaders you support?,-
0,How do you approach discussions with people who have opposing political beliefs? What strategies or guidelines do you use to maintain a respectful and constructive dialogue?,-
0,"How do you evaluate political information and news? What sources do you trust, and how do you discern bias or misinformation?",-
0,"How do you see the relationship between politics and morality? Are there moral imperatives that guide your political decisions, and if so, what are they?",-
0,"How do you engage with politics on a local, national, and international level? How do your political beliefs influence your involvement or activism?",-
0,"How do you balance your political beliefs with other aspects of your identity, such as your cultural background, profession, or personal relationships?",-
0,"How do you view the role of compromise in politics, both in terms of policy-making and your personal beliefs? Can you share examples where compromise has been challenging or rewarding for you?",-
0,"How do your political beliefs intersect with issues such as economic policy, social justice, environmental stewardship, and foreign relations?",-
0,How do you envision the ideal political system or government? What changes would you like to see in your current political landscape to move closer to that ideal?,-
0,How do you handle political disillusionment or frustration? What keeps you engaged or hopeful in the political process?,-
0,"How do your political beliefs influence your daily life and decisions, such as your consumer choices, career, or community involvement?",-
0,"How do you view the future of politics in your country and globally? What trends or challenges do you foresee, and how do you prepare or respond to them?",-
0,"If you were to mentor someone who is just beginning to explore their political beliefs, what advice or guidance would you offer them?",-
0,"How have your background, experiences, and community influenced your perspectives on social issues? Can you identify any specific experiences that shaped your views?",-
0,"What social issues do you feel most passionately about, and why? How do you engage with these issues in your daily life?",-
0,How do you approach conversations with people who have different views on social issues? What strategies do you employ to foster understanding and empathy?,-
0,How do you evaluate information and sources when forming your views on social issues? What role does critical thinking play in shaping your beliefs?,-
0,How do your views on social issues align with your broader moral or ethical framework? Are there any principles that guide your thinking across different issues?,-
0,How do you balance individual rights and community responsibilities when considering social issues? Can you provide examples of how you navigate this balance?,-
0,How do you see the intersection between social issues and political policies? What role do you believe government should play in addressing social problems?,-
0,How do you respond to social issues that challenge your existing beliefs or comfort zones? How do you approach learning about and engaging with unfamiliar or contentious issues?,-
0,"How do your views on social issues impact your relationships, career, or community involvement? Can you share examples of how these beliefs manifest in your actions?",-
0,"How do you view the role of activism, volunteerism, or philanthropy in addressing social issues? What personal commitments have you made in these areas?",-
0,"How have your views on specific social issues changed over time? What prompted those changes, and what did you learn from the process?",-
0,How do you approach social issues that may not directly affect you or your community? What motivates you to care about or engage with these issues?,-
0,"How do you envision the future of social issues in your community, country, or globally? What challenges or opportunities do you foresee, and how do you prepare for them?",-
0,How do you prioritize or balance your engagement with different social issues? Are there conflicts or synergies that you navigate between various concerns?,-
0,"If you could influence one significant change related to a social issue that matters to you, what would it be, and why? How would you work toward achieving that change?",-
0,"How do you define environmental stewardship, and why is it important to you? How does it align with your overall values and principles?",-
0,"What specific environmental issues concern you the most, and why? How do you see these issues impacting your community, country, or the world?",-
0,How do you integrate environmental stewardship into your daily life? Can you share examples of sustainable practices or choices you make regularly?,-
0,How do you balance economic growth and development with environmental protection and sustainability? What trade-offs or challenges do you see in this area?,-
0,"How do you view the role of government, corporations, and individuals in promoting environmental stewardship? What responsibilities do you believe each sector should have?",-
0,"How do you engage with others on environmental issues, especially with those who may have different views or priorities? What strategies do you use to foster collaboration or understanding?",-
0,How do you approach environmental education and awareness? What resources or methods do you rely on to stay informed and encourage others to do the same?,-
0,How do you evaluate the environmental impact of products or services you consume? What criteria do you use to make environmentally responsible choices?,-
0,How have your views on environmental stewardship evolved over time? Can you identify experiences or insights that have shaped your growth in this area?,-
0,How do you view the intersection of technology and environmental stewardship? What opportunities or concerns do you see in leveraging technology for sustainability?,-
0,"How do you envision the future of environmental stewardship? What trends or innovations do you see as most promising, and what challenges must be overcome?",-
0,How do you engage with nature personally? How does your connection to the natural world influence your views on environmental stewardship?,-
0,"If you could influence or implement one major environmental policy or initiative, what would it be, and why? How would you go about achieving that goal?",-
0,"How do you structure your day, and what does your ideal daily routine look like? Why?",-
0,What daily habit has had the most positive impact on your life or well-being? How did you cultivate it?,-
0,"Are there routines or habits you've struggled to adopt or maintain? What challenges did you face, and how did you address them?",-
0,"How do external factors, like work or family commitments, influence your daily routines? How do you balance or adapt your habits to these commitments?",-
0,How do you prioritize tasks or activities in your daily life? Are there guiding principles or values that help you make these decisions?,-
0,"What rituals or habits help you transition between different parts of your day, such as morning to work or work to leisure?",-
0,How do your daily routines vary on weekdays versus weekends? What drives those differences?,-
0,How do you handle disruptions or unexpected events in your daily routine? What strategies do you use to adapt or regain focus?,-
0,"What role does technology play in your daily habits? Do you see it as a tool, a distraction, or both?",-
0,"Are there any habits or routines you've adopted from other cultures, traditions, or individuals that have particularly resonated with you? Why?",-
0,How do you see the connection between your daily habits and your long-term goals or aspirations?,-
0,In what ways do you incorporate self-care or relaxation into your daily routine? How do you ensure you're taking time for yourself amidst other responsibilities?,-
0,"How have significant life events (like moving to a new city, a change in job, or personal milestones) affected your daily routines? How did you navigate those changes?",-
0,How do you envision the evolution of your daily routines as you age or as your priorities shift?,-
0,"If you were to mentor someone in developing a productive and balanced daily routine, what advice or insights would you share based on your experiences?",-
0,"What is your biggest dream or ambition, and why is it meaningful to you? How does it align with your values and core beliefs?",-
0,"How have your dreams and ambitions evolved over time? Can you identify specific events, people, or experiences that have shaped or redirected them?",-
0,"What obstacles or challenges have you faced in pursuing your dreams, and how have you overcome them? What did you learn from those experiences?",-
0,How do you balance your current responsibilities and commitments with working towards your long-term dreams and goals?,-
0,"How do you stay motivated and focused on your ambitions, especially when facing setbacks or distractions?",-
0,How do you align your daily habits and routines with your bigger dreams and ambitions? What specific actions are you taking to make your dreams a reality?,-
0,"How do you seek support, mentorship, or collaboration to help you achieve your dreams? What role do others play in your journey?",-
0,How do you measure progress or success in reaching your dreams? What benchmarks or milestones do you set for yourself?,-
0,"How do you handle conflicting dreams or goals? Have you ever had to choose between two or more paths, and how did you make that decision?",-
0,How do you approach risk and uncertainty when pursuing your dreams and ambitions? What role does courage or fear play in your decisions?,-
0,How do your dreams and ambitions fit into your broader life vision or purpose? Are there overarching themes or connections you see between different areas of your life?,-
0,How do you envision your dreams impacting others or contributing to society? What legacy do you hope to leave through your ambitions?,-
0,"How do you nurture and protect your dreams in the face of skepticism, doubt, or external pressures? What keeps you connected to what truly matters to you?",-
0,"Are there any dreams or goals that you've let go of or changed significantly? How did you navigate that process, and what did it teach you about yourself?",-
0,"If you were to mentor or inspire someone else in pursuing their dreams, what wisdom or advice would you share based on your experiences and insights?",-
0,"Can you describe a decision or action you regret? What led to that choice, and why do you wish you had acted differently?",-
0,How do you process or cope with feelings of regret? What strategies or practices have you found helpful?,-
0,How have your regrets influenced your subsequent choices or behavior? Can you share an example where a regretful experience led to growth or positive change?,-
0,Are there things in your life that you once regretted but now view differently? What changed your perspective?,-
0,How do you balance learning from past mistakes without becoming consumed or paralyzed by regret?,-
0,"Can you think of a time when you chose not to act and later regretted that inaction? What held you back, and what would you do differently now?",-
0,"How do you approach forgiveness, both of yourself and others, when dealing with regrets? How does this process affect your relationships and self-perception?",-
0,Are there societal or cultural expectations that have influenced your regrets or things you wish to change? How have you navigated these pressures?,-
0,How do you distinguish between healthy reflection on past mistakes and unhealthy dwelling on regret? What boundaries or guidelines do you set for yourself?,-
0,"How do you involve others, such as friends, family, or mentors, in processing regrets or decisions you wish to change? What role do they play in your reflection?",-
0,Are there regrets tied to missed opportunities or dreams you didn't pursue? How do you reconcile with these paths not taken?,-
0,How do you integrate your regrets and lessons learned into your current goals and future planning?,-
0,Are there any positive aspects or silver linings you've found in situations you initially regretted? How did you come to see them?,-
0,"If you could go back in time and change one thing about your life, what would it be, and why? How do you think it would alter your current situation?",-
0,"How do you approach the concept of regret philosophically or spiritually? Do you see it as a necessary part of human experience, or something to be minimized or avoided?",-
0,"What are your greatest hopes for your personal future, and why? How do they align with your core values and beliefs?",-
0,"How do you envision the future of your community or society? What changes or developments do you hope to see, and why?",-
0,"What predictions do you have for the world in areas such as technology, politics, environment, or culture? How do you feel about these potential changes?",-
0,Are there any fears or concerns you have about the future? How do you cope with or address these anxieties?,-
0,How do you balance your hopes and predictions for the future with living in the present moment? What practices help you maintain this balance?,-
0,How do your future predictions influence your current decisions and actions? Can you give an example of how your vision of the future guides your behavior today?,-
0,How do you approach goal setting and planning for the future? How do you ensure alignment with your deeper hopes and values?,-
0,"How do you involve others, such as family, friends, or community, in your hopes and plans for the future? What role do relationships play in shaping your vision?",-
0,How do you handle uncertainty and unpredictability when thinking about the future? What strategies or philosophies guide you in the face of unknowns?,-
0,How have your predictions and hopes for the future evolved over time? What experiences or insights have led to these changes?,-
