recorded,question,answer
0,"What role do mentors, role models, or support systems play in your journey toward success? Can you share specific examples?",-
0,"Have you ever had to redefine or reassess what success means to you? What prompted this change, and how did it affect your goals or outlook?",-
0,How do you handle the stress or challenges that often accompany the pursuit of success? What techniques or mindsets help you maintain resilience?,-
0,What do you think future generations should understand or prioritize about success? How would you like societal attitudes towards success to evolve?,-
0,Can you describe an unconventional or surprising path to success that you've either experienced or observed? What did it teach you about the nature of success?,-
0,"Looking forward, what does success look like to you in the next stage of your life or career? How have your past experiences shaped this vision?",-
0,Who are the mentors or role models that have had the most significant impact on your life? What drew you to them?,-
0,Can you describe a specific experience with a mentor or role model that greatly influenced your development? What lessons did you take away from that experience?,-
0,What qualities do you value most in mentors or role models? How do these qualities align with your personal values or goals?,-
0,"Have you ever been surprised to find a mentor or role model in an unexpected place or person? How did this relationship come about, and what did you learn from it?",-
0,How do you seek out mentors or role models to guide you in various aspects of life? What strategies have been effective for you?,-
0,"How do you differentiate between a mentor and a role model? Do you engage with them differently, and if so, how?",-
0,"Have you ever had a mentoring relationship that didn’t go as planned or had unexpected challenges? How did you navigate those challenges, and what did you learn?",-
0,In what ways do you believe mentors or role models have contributed to your success or failures? Can you provide specific examples?,-
0,"Have you ever taken on the role of a mentor yourself? What was that experience like, and how did it affect your perspective on mentorship?",-
0,"What role do you think mentors and role models play in today's society, especially in the context of professional development, education, or community building?",-
0,How do you maintain relationships with mentors or role models over time? Are there any unique challenges or benefits to these long-term connections?,-
0,"Do you believe that mentors and role models must share similar backgrounds, beliefs, or values with those they guide? Why or why not?",-
0,How do you reconcile or deal with any disagreements or conflicts with a mentor or role model? Have you ever faced such a situation?,-
0,What advice would you give to someone seeking a mentor or wanting to become a mentor? What do you wish you had known when you first started seeking guidance from others?,-
0,"Looking forward, how do you envision the role of mentors and role models in your life evolving? Are there areas where you feel you need new guidance or inspiration?",-
0,"How do you generally approach decision-making, both in your personal life and professional career? Do you lean towards intuition, analysis, or a combination of both?",-
0,"Can you describe a time when you faced a particularly challenging decision? What factors did you consider, and how did you arrive at your conclusion?",-
0,How do you handle decisions that involve significant risks or uncertainties? What strategies do you use to evaluate and mitigate those risks?,-
0,What role do ethics and values play in your decision-making process? Can you share an example where your moral compass guided a decision?,-
0,"How do you approach decisions that involve conflicting interests or priorities, either within yourself or among different stakeholders? How do you navigate these conflicts?",-
0,"Have you ever made a decision that went against popular opinion or conventional wisdom? What motivated you, and how did you handle any resulting criticism or resistance?",-
0,"How do you incorporate feedback or advice from others when making a decision? Do you have specific mentors, friends, or colleagues whose perspectives you regularly seek?",-
0,"Can you describe a decision that you now recognize was a mistake? What did you learn from that experience, and how has it influenced subsequent decisions?",-
0,"What role does emotion play in your decision-making process? Are you conscious of emotional biases, and how do you mitigate or leverage them?",-
0,How do you handle decision-making under time pressure or in crisis situations? What strategies help you stay focused and make effective choices?,-
0,"Do you use any specific frameworks, models, or tools to assist in decision-making? How do they enhance your process?",-
0,How do you ensure that you follow through on decisions once they are made? What mechanisms or routines help you stay accountable to your commitments?,-
0,"What are your thoughts on collective or collaborative decision-making? Have you engaged in such processes, and what are the challenges and benefits you’ve experienced?",-
0,How has your decision-making process evolved over time? What experiences or insights have shaped this evolution?,-
0,"Looking ahead, are there aspects of your decision-making process that you aim to improve or develop further? What steps are you taking to achieve those goals?",-
0,"How often do you take time for self-reflection, and what methods or practices do you use? Do you find journaling, meditation, or other techniques helpful?",-
0,"Can you describe a moment of self-reflection that led to a significant realization or change in your life? What was the insight, and how did it affect you?",-
0,How do you balance self-reflection with action and decision-making in your life? Have you ever felt paralyzed by overthinking or overanalyzing?,-
0,"How do you approach reflecting on mistakes or failures? What have you learned from these experiences, and how have you applied those lessons?",-
0,In what ways have self-reflection and introspection contributed to your understanding of your core values and beliefs? Can you share specific examples?,-
0,How do you handle self-criticism during self-reflection? Do you have strategies to maintain a balanced and compassionate perspective on yourself?,-
0,"Do you ever engage in reflective practices with others, such as friends, family, or mentors? How does that collaborative reflection differ from individual introspection?",-
0,How has self-reflection influenced your relationships with others? Have insights into yourself affected how you relate to or understand others?,-
0,"Can you share a time when self-reflection led you to change a strongly held belief or assumption? What prompted this change, and how did you navigate it?",-
0,"How has self-reflection played a role in your career or professional development? Have you used it to set goals, navigate challenges, or understand your strengths and weaknesses?",-
0,"Do you ever find self-reflection challenging or uncomfortable? How do you deal with those challenges, and what supports you in continuing the practice?",-
0,How do you evaluate progress or growth in your self-reflection journey? Are there specific milestones or indicators that you look for?,-
0,What role does self-reflection play in your understanding of your mental and emotional well-being? How does it contribute to self-care or personal resilience?,-
0,"Are there cultural, philosophical, or spiritual traditions that inform your practice of self-reflection? How do these influences shape your approach?",-
0,"Looking to the future, how do you envision your practice of self-reflection evolving? What new areas would you like to explore, or what deeper understanding do you seek?",-
0,"How would you define critical thinking, and why do you consider it important? Can you provide examples of how you use critical thinking in your daily life?",-
0,"Can you describe a situation where your critical thinking skills led to a significant breakthrough or solution? What was the problem, and how did you approach it?",-
0,What strategies or techniques do you use to analyze complex problems? How do you break them down into manageable parts?,-
0,How do you approach evaluating different sources of information for reliability and relevance? What criteria do you use to assess credibility?,-
0,"In what ways do you seek to develop and strengthen your critical thinking skills? Are there particular books, courses, or practices that you find helpful?",-
0,"Can you recall a time when your critical thinking skills were challenged? How did you respond, and what did you learn from that experience?",-
0,How do you ensure that your critical thinking does not become overly critical or dismissive of others' perspectives? How do you balance skepticism and open-mindedness?,-
0,What role does creativity play in your critical thinking process? How do you integrate creative thinking with analytical reasoning?,-
0,How do you navigate situations where emotions or biases might interfere with critical thinking? Do you have techniques to recognize and mitigate these influences?,-
0,"Have you ever changed your mind on a significant issue as a result of critical thinking? What prompted the change, and how did you process it?",-
0,How do you use critical thinking to set goals and make decisions in your personal or professional life? Can you share a specific example?,-
0,What are some common misconceptions or misunderstandings about critical thinking that you have encountered? How do you address or overcome them?,-
0,"How do you foster critical thinking in others, such as colleagues, students, or children? What approaches or methods do you find most effective?",-
0,"How does critical thinking relate to other intellectual skills or virtues, such as wisdom, empathy, or integrity? How do you see these concepts as interconnected?",-
0,"Looking to the future, how do you envision the role of critical thinking in emerging technologies, societal challenges, or global issues? What are the implications for education, leadership, or innovation?",-
0,How do you define wisdom in the context of relationships? What qualities or behaviors exemplify wise handling of interpersonal dynamics?,-
0,"Can you describe a time when you handled a relationship challenge with particular wisdom or insight? What was the situation, and how did you approach it?",-
0,How do you balance your own needs and desires with those of others in your relationships? What strategies or principles guide you in maintaining this equilibrium?,-
0,"What role does empathy play in your relationships, and how do you cultivate it? Can you share an example of how empathy enhanced a connection or resolved a conflict?",-
0,"How do you approach communication in your relationships, especially during disagreements or misunderstandings? What techniques do you use to ensure clarity and compassion?",-
0,"Can you recall a relationship that required significant patience, tolerance, or forgiveness? How did you navigate these challenges, and what did you learn?",-
0,How do you recognize and set healthy boundaries in your relationships? What has been your experience with enforcing or respecting these limits?,-
0,What role do trust and vulnerability play in deepening your relationships? How do you build and sustain trust with those close to you?,-
0,"Have you ever had to end or significantly change a relationship due to irreconcilable differences or toxic dynamics? How did you handle that process, and what wisdom did you gain?",-
0,"How do you nurture and invest in your relationships over time? What practices or rituals help you maintain and strengthen connections with family, friends, or colleagues?",-
0,"How do you handle relationships with people who have significantly different beliefs, values, or lifestyles? What strategies promote understanding and respect despite these differences?",-
0,"How has your approach to relationships evolved over time? What experiences or insights have shaped this growth, and how do you see yourself continuing to evolve?",-
0,"What role do mentors, role models, or wise figures play in your understanding of relationships? Have you learned specific lessons or practices from others that you now incorporate?",-
0,How do you view the connection between wisdom in relationships and broader societal or community well-being? Do you see your interpersonal wisdom as contributing to a larger social good?,-
0,"Looking to the future, what challenges or opportunities do you anticipate in your relationships? How are you preparing to meet them with wisdom and intention?",-
0,"How do you define wealth? Is it strictly financial, or does it include other forms of abundance, such as relationships, health, or knowledge?",-
0,What beliefs or attitudes about money were you taught growing up? How have these shaped your current perspective on wealth?,-
0,How do you balance the desire for financial security with other life values or goals? Can you share an example of a decision where you had to weigh these factors?,-
0,What role does money play in your sense of success or self-worth? How do you separate or integrate these concepts?,-
0,How do you approach charitable giving or philanthropy? What principles or values guide your decisions about sharing or donating wealth?,-
0,"Can you describe a financial decision that you regret or feel proud of? What did you learn from that experience, and how has it informed your subsequent choices?",-
0,"What financial goals do you have for the future, and why are they important to you? How are you working toward these goals, and what challenges do you anticipate?",-
0,"How do you view the ethics of wealth accumulation and distribution in society? What responsibilities, if any, do you believe individuals or businesses have toward broader economic equality?",-
0,"How do you approach financial education, either for yourself or others (such as children or employees)? What resources or methods have you found effective?",-
0,"What is your perspective on debt, including personal debt like credit cards or mortgages, and broader societal debt? How has this view influenced your financial decisions or opinions?",-
0,How do you handle financial stress or uncertainty? What strategies or supports help you navigate these challenges?,-
0,"What is your attitude toward investment, whether in stocks, real estate, or other ventures? How do you assess risk, reward, and alignment with your values?",-
0,How do you view the relationship between money and happiness? Can you provide examples of how wealth has or has not contributed to your overall well-being?,-
0,"What cultural, societal, or historical influences shape your perspective on money and wealth? How do these factors interact with your personal beliefs or experiences?",-
0,"Looking to the future, how do you envision your relationship with money evolving? What changes or growth do you anticipate, and how are you preparing for them?",-
0,"How do you define a meaningful relationship? What elements are essential for you in a connection with friends, family, or romantic partners?",-
0,"Can you describe a time when you had to work on building or repairing a relationship? What strategies did you use, and what did you learn from the experience?",-
0,"What role do social media and technology play in your relationships? Do you see these as positive or negative influences, or a combination of both?",-
0,How do you approach new social situations or meeting new people? What challenges or joys do you find in forming new connections?,-
0,"What's your perspective on friendship across different stages of life? How have your friendships evolved as you've grown older, and what have been the constants?",-
0,How do you navigate conflicts or disagreements in relationships? What principles guide you in resolving or managing these situations?,-
0,What impact has your cultural background had on your approach to relationships? How do cultural norms or values shape the way you connect with others?,-
0,Can you share a story about a mentor or role model who has significantly impacted your life? What qualities or lessons from this relationship continue to influence you?,-
0,How do you balance personal independence with the needs and expectations of relationships? Are there times when you've struggled with this balance?,-
0,"What are your thoughts on vulnerability and trust in relationships? How do you cultivate these aspects, and how do they contribute to deeper connections?",-
0,How do you approach relationships with colleagues or professional networks? What distinguishes these relationships from personal friendships or family connections?,-
0,"What are your thoughts on romantic relationships, including aspects like commitment, compatibility, and communication? How do these thoughts reflect your own experiences or beliefs?",-
0,"How do you nurture and maintain long-distance relationships, whether friendships or romantic connections? What challenges and rewards have you encountered?",-
0,"Can you recall a relationship that ended, either through a breakup, drifting apart, or death? How did you cope with the loss, and what insights did you gain?",-
0,"Looking to the future, how do you envision your social and relationship needs evolving? Are there specific goals or changes you foresee in how you connect with others?",-
0,How do you define a true friend? What qualities or behaviors are essential for you in a friendship?,-
0,Can you describe a time when a friend greatly impacted your life or helped you through a challenging situation? What did you learn from that experience?,-
0,How have your friendships evolved over different stages of your life? Are there noticeable patterns or significant changes that you can identify?,-
0,"What are your expectations in a friendship regarding communication, time spent together, and emotional support? How do you communicate these expectations to your friends?",-
0,"Have you ever experienced a friendship that became toxic or unhealthy? How did you recognize the situation, and how did you handle it?",-
0,"How do you approach making new friends, especially as an adult? What strategies or mindsets do you find helpful?",-
0,"What role does trust play in your friendships? How do you build and maintain trust, and how do you handle situations where trust might be broken?",-
0,"How do you navigate differences in values, beliefs, or lifestyles with your friends? Can you share an example where this was challenging or enlightening?",-
0,"Do you believe in the concept of having a ""best friend""? Why or why not? How does this idea fit into your understanding of friendships?",-
0,How do you balance your friendships with other relationships such as family or romantic partners? Have you ever faced a conflict between these different relationships?,-
0,What do you think about maintaining friendships with ex-partners or people from different phases of your life? What boundaries or guidelines do you follow in these situations?,-
0,How do you nurture and invest in your friendships to keep them strong and fulfilling? Are there particular practices or rituals that you find meaningful?,-
0,How do you handle conflicts or misunderstandings in a friendship? Can you recall a time when you had to work through a disagreement?,-
0,"Can you describe a friendship that has endured significant change, such as a long-distance move, career shift, or life-altering event? What kept the friendship intact?",-
0,"Looking to the future, what are your hopes or intentions for your friendships? Are there specific types of friendships you want to cultivate, or ways you want to grow as a friend?",-
0,How would you describe your role within your family? Has it evolved over time?,-
0,What values do you believe are most important in maintaining healthy family relationships?,-
0,Can you recall a specific family event or tradition that significantly influenced your outlook on family dynamics?,-
0,How do you handle conflicts within your family? What strategies have you found effective?,-
0,"In your opinion, what defines a strong sense of unity and closeness within a family?",-
0,Are there any generational differences in your family that you find particularly intriguing or challenging?,-
0,"How has your upbringing shaped your expectations for your own future family, if at all?",-
0,"What role does communication play in your family, and how has it contributed to the overall dynamics?",-
0,Are there any cultural or traditional aspects that influence how your family interacts and makes decisions?,-
0,Can you think of a time when your family faced a difficult decision or situation? How did you collectively handle it?,-
0,How do you balance the individual needs and aspirations of family members with the collective well-being of the family unit?,-
0,What is your view on boundaries within a family? How do they impact relationships?,-
0,What do you believe is the role of forgiveness and empathy in maintaining healthy family dynamics?,-
0,"How has technology affected your family relationships, both positively and negatively?",-
0,Can you share an example of a significant family disagreement and how it was resolved? What did you learn from the experience?,-
0,"What does the concept of ""love"" mean to you, and how has it evolved over the course of your life?",-
0,Can you recall a specific moment or experience that shaped your understanding of what a healthy romantic relationship looks like?,-
0,How do you balance the idea of personal independence with the desire for intimacy in a romantic relationship?,-
0,Are there any past relationships that have had a lasting impact on the way you approach new romantic connections?,-
0,"What qualities or values do you prioritize when seeking a romantic partner, and why are they important to you?",-
0,How do you navigate differences and conflicts within a romantic relationship while maintaining a sense of harmony?,-
0,"In your opinion, what role does communication play in fostering a strong and lasting romantic connection?",-
0,Are there any cultural or societal influences that have affected your perception of romantic relationships and love?,-
0,How do you view the concepts of compromise and sacrifice within the context of a romantic partnership?,-
0,Can you share a moment when you took a risk for love? What did you learn from that experience?,-
0,What are your thoughts on the balance between passion and companionship in a long-term romantic relationship?,-
0,How has technology and social media impacted the way you approach dating and maintaining romantic connections?,-
0,"What does trust mean to you in the context of a romantic relationship, and how do you build and maintain it?",-
0,How do you envision your ideal future with a partner? What values and experiences do you hope to share?,-
0,Can you reflect on a time when you faced a significant challenge in a romantic relationship? How did it shape you and your perspective on love?,-
0,"How do you define ""social skills,"" and what role do you believe they play in personal and professional success?",-
0,Can you recall a specific experience that made you realize the importance of effective communication in social interactions?,-
0,How do you approach initiating conversations with new people in social or networking settings?,-
0,Are there any specific strategies you use to build rapport and establish a genuine connection with others?,-
0,What challenges do you find most difficult to overcome when it comes to socializing and networking? How do you handle them?,-
0,"In your opinion, what qualities make someone a good listener, and how do you practice active listening in conversations?",-
0,"How do cultural differences impact your approach to socializing and networking, and how do you bridge potential gaps?",-
0,Can you share a situation where you had to step out of your comfort zone to expand your social circle or professional network?,-
0,How do you strike a balance between being authentic and adapting your communication style to different social contexts?,-
0,"What is your view on maintaining relationships in the digital age, and how do you use technology to nurture connections?",-
0,Can you recall an instance where networking led to a valuable opportunity or a meaningful relationship? How did it come about?,-
0,How do you handle rejection or social setbacks when trying to connect with others? What strategies do you use to bounce back?,-
0,How do you navigate group dynamics and contribute effectively when interacting with a diverse set of individuals?,-
0,Are there any mentors or role models who have influenced your approach to social skills and networking? How so?,-
0,"Reflecting on your social interactions, what have you learned about yourself and your growth in terms of social skills?",-
0,"How do you define ""conflict,"" and what emotions or thoughts does it evoke for you personally?",-
0,Can you recall a specific conflict from your past that taught you valuable lessons about resolving differences?,-
0,How do you approach conflicts: as challenges to overcome or opportunities for growth and understanding?,-
0,What methods or strategies do you typically employ to maintain your composure and clarity during heated disagreements?,-
0,"In your opinion, what role does effective communication play in resolving conflicts? How do you ensure your message is heard?",-
0,Are there any cultural or personal factors that influence your conflict resolution style? How have they shaped your approach?,-
0,Can you share a time when you successfully mediated a conflict between others? What strategies did you use?,-
0,How do you balance the desire to stand your ground with the willingness to compromise for the sake of resolution?,-
