recorded,question,answer
0,What values are most important to you and why? How have these values shaped your life and decision-making process?,-
0,"Can you recall a moment in your life when your values were challenged? How did you respond, and what did you learn from that experience?",-
0,How do your values align or clash with the culture of your community or workplace? How do you navigate those differences?,-
0,"What are some values you admire in others but find challenging to implement in your life? Why is that, and have you taken steps to adopt these values?",-
0,How have your values changed or evolved over time? Were there key experiences or individuals that influenced these changes?,-
0,"Can you think of a person who embodies the values you hold dear? How do they inspire you, and what have you learned from them?",-
0,"In what ways do your values influence your relationships with friends and family? Are there shared values that strengthen these relationships, or differences that create tension?",-
0,How do your personal values align with your professional goals and ethics? How do you balance them if conflicts arise?,-
0,"Have you ever had to make a difficult decision where your values guided you? What was the outcome, and would you make the same decision again?",-
0,How do you handle situations where your values are in conflict with one another? Can you provide an example?,-
0,"Do you believe that some values are universal, or are they all culturally and individually determined? Why?",-
0,How do you ensure that you live in accordance with your values on a daily basis? Are there rituals or habits you've developed to reinforce them?,-
0,"Do you think it's ever acceptable to compromise your values? Under what circumstances, and what would be the potential risks and benefits?",-
0,How would you like to further develop or refine your values in the future? Are there new values you'd like to explore or old ones you'd like to strengthen?,-
0,"If you had to choose one value that represents who you are at your core, what would it be and why? How does that value manifest in your daily life and long-term goals?",-
0,What drives you to get up every morning? What keeps you motivated even during tough times?,-
0,Can you describe a long-term goal you've set for yourself? What steps have you taken or plan to take to achieve it?,-
0,"How do your personal values align with your current motivations and goals? Are there any conflicts, and how do you address them?",-
0,"Have you ever experienced a failure in pursuing a goal? How did you handle it, and what did you learn from the experience?",-
0,"What role do other people (family, mentors, friends) play in your goal-setting and motivation? How do they support or hinder you?",-
0,How do you balance your personal and professional goals? Have you ever had to choose between them?,-
0,"Can you recall a time when your motivations drastically changed? What caused this shift, and how did it impact your goals?",-
0,How do you handle setbacks or obstacles in pursuing your goals? What strategies do you use to overcome them?,-
0,"What are some short-term goals you have, and how do they connect to your long-term vision? How do you prioritize them?",-
0,"How do you ensure that your goals are realistic and achievable, yet still challenging? What tools or methods do you use to assess them?",-
0,"Have you ever pursued a goal that others thought was unattainable or unreasonable? How did their opinions affect you, if at all?",-
0,"Do you have any unfulfilled dreams or goals? What has stopped you from pursuing them, and do you plan to revisit them in the future?",-
0,How do you celebrate achieving a goal? Does this celebration motivate you to pursue new goals?,-
0,"How do you differentiate between a genuine, inner motivation and external pressures or expectations? Can you provide an example?",-
0,"If you could achieve any one goal instantly, what would it be and why? What would achieving this goal mean to you personally?",-
0,What do you consider to be your greatest strengths? How have you utilized these strengths in various aspects of your life?,-
0,Can you describe a weakness you've turned into a strength? How did you go about making that transformation?,-
0,How do you handle situations where your weaknesses are exposed? Can you share an example of a time when this happened?,-
0,"How do others perceive your strengths and weaknesses? Are their perceptions aligned with your own, and why or why not?",-
0,"Have you ever over-relied on a strength, and did it become a weakness in a particular situation? How did you recognize and address this?",-
0,How do your strengths align with your career or personal goals? Are there new strengths you'd like to develop to better align with your aspirations?,-
0,Can you describe a situation where you had to rely on your strengths to overcome a challenge? What did you learn from that experience?,-
0,What strategies do you use to overcome or mitigate your weaknesses? Are there specific resources or support systems you rely on?,-
0,How do you balance focusing on your strengths with addressing your weaknesses? Is one more of a priority for you?,-
0,"Can you think of a person who complements your strengths and weaknesses? How do you work together, and what benefits does this synergy bring?",-
0,Do you believe that recognizing weaknesses is a sign of self-awareness or a lack of confidence? How do you embrace your weaknesses?,-
0,How have your strengths and weaknesses evolved over time? What events or experiences have influenced these changes?,-
0,"In what ways do your strengths and weaknesses affect your relationships with others, both personally and professionally? How do you navigate these dynamics?",-
0,"Are there weaknesses you've accepted and chosen not to change? Why, and how do you cope with them?",-
0,How do you respond to feedback or criticism about your strengths and weaknesses? Can you share an example of feedback that led to personal growth?,-
0,How do you typically recognize when you are feeling stressed? What physical or mental signs alert you to your stress levels?,-
0,"What are some common sources of stress for you, both in your personal and professional life? How do you prioritize dealing with them?",-
0,"Can you describe a particularly stressful situation you've faced and how you handled it? What would you do differently, if anything?",-
0,How do you differentiate between healthy stress (eustress) and unhealthy stress (distress)? How do you leverage positive stress in your life?,-
0,What are your go-to strategies or techniques for managing stress? How did you discover or develop them?,-
0,"Have you ever sought professional help (such as therapy) for stress management? If so, what insights or skills did you gain?",-
0,How do your personal values and goals influence your response to stress? Do they act as a motivator or additional stressor?,-
0,Do you believe that some level of stress is necessary or beneficial for personal growth or productivity? Why or why not?,-
0,How do you balance taking care of yourself with meeting external demands and responsibilities when feeling stressed?,-
0,Can you share a time when stress negatively affected your health or relationships? How did you recognize and address the issue?,-
0,"How do you help or support friends, family, or coworkers who are experiencing stress? What role does empathy play in your approach?",-
0,"Have you ever experienced burnout? How did you recover, and what preventive measures have you put in place?",-
0,How do you create a stress-free environment at home or work? What routines or rituals promote relaxation and well-being?,-
0,Do you think society's attitudes toward stress and mental health are changing? How have these changes impacted your personal approach to stress management?,-
0,"How do you continue to learn and grow in your ability to manage stress? Are there books, mentors, courses, or other resources that have been particularly impactful?",-
0,Can you describe a significant failure you've experienced in your life? How did you initially react to it?,-
0,How has failure shaped your attitude towards risk-taking and pursuing your goals? Are you more or less risk-averse as a result?,-
0,"What lessons have you learned from failure, and how have they influenced your subsequent decisions or behaviors?",-
0,How do you differentiate between a productive failure (one that leads to growth) and an unproductive failure? Can you provide examples?,-
0,"Have you ever been afraid to try something because of a fear of failure? How did you overcome that fear, or how has it held you back?",-
0,How do you cope with failure in the short term? What immediate strategies or support systems do you rely on?,-
0,How has your perspective on failure evolved over time? Were there specific experiences or individuals that contributed to this evolution?,-
0,Do you believe that failure is a necessary part of success? Why or why not?,-
0,How do you approach failure in a team or collaborative setting? How do you handle both your failure and the failure of others?,-
0,How do cultural or societal attitudes toward failure influence your own reactions? Have you ever felt pressure to hide or downplay a failure?,-
0,How do you incorporate feedback or criticism following a failure? How do you differentiate between constructive and unhelpful feedback?,-
0,Have you ever experienced imposter syndrome following a failure? How did you recognize and address this feeling?,-
0,How do you set yourself up for success following a failure? What changes or adaptations do you make to ensure a different outcome?,-
0,"What role do mentors, friends, or family play in helping you navigate failure? Can you share a time when someone's support was crucial?",-
0,"Do you have a favorite quote, book, or philosophy that guides your perspective on failure? How does it resonate with your personal experience?",-
0,"How do you define empathy and compassion, and what differences do you see between them?",-
0,Can you share a specific instance when you felt a strong sense of empathy or compassion towards someone? How did you act on those feelings?,-
0,"Have you ever found it challenging to empathize with someone? What barriers did you encounter, and how did you overcome them?",-
0,How do you practice empathy and compassion in your everyday interactions? Are there specific behaviors or habits that help you cultivate these qualities?,-
0,"Do you believe that empathy and compassion can be learned and developed, or are they innate qualities? Why do you think so?",-
0,How do you maintain boundaries while being empathetic and compassionate? Have you ever felt overwhelmed by taking on others' emotions?,-
0,"How have empathy and compassion influenced your relationships, both personally and professionally? Can you share an example?",-
0,What role do empathy and compassion play in conflict resolution or difficult conversations? How do you apply them in such situations?,-
0,"How do you show compassion toward yourself, especially during challenging times or after a failure?",-
0,"How do cultural, social, or familial backgrounds influence the way empathy and compassion are expressed and experienced? Have you noticed differences in various contexts?",-
0,Can you think of a public figure or role model who embodies empathy and compassion? What can you learn from their example?,-
0,What are some misconceptions or pitfalls related to empathy and compassion? Have you ever experienced or observed these?,-
0,How does technology and virtual communication affect the way we express and experience empathy and compassion?,-
0,"What are some practical ways to nurture empathy and compassion within communities, workplaces, or families? How have you participated in or benefited from these efforts?",-
0,Do you think that empathy and compassion are more or less important in today's world compared to the past? How do you see these qualities evolving in the future?,-
0,How do you define assertiveness and confidence? How are they similar or different in your perspective?,-
0,"Can you describe a situation where you demonstrated assertiveness? What were the outcomes, and how did you feel about it?",-
0,Have you ever struggled with confidence in a particular area of your life? How have you worked to overcome that challenge?,-
0,What strategies or techniques do you use to build and maintain confidence? Have they changed over time or across different contexts?,-
0,How do you strike a balance between assertiveness and empathy in interpersonal relationships? Can you share an example?,-
0,"Have you ever been perceived as over-confident or overly assertive? How did you handle that perception, and did it lead to any self-reflection?",-
0,How has your level of assertiveness and confidence influenced your career or personal growth? What role have mentors or role models played in shaping these qualities?,-
0,"Do you believe that assertiveness and confidence can be learned? If so, what resources or experiences have been most impactful for you?",-
0,"How do cultural, gender, or social factors influence the way assertiveness and confidence are expressed and perceived? Have you noticed any disparities or biases?",-
0,"How do you respond to failure or rejection, and what role does assertiveness and confidence play in that response?",-
0,What role does self-awareness play in your ability to be assertive and confident? How do you ensure that your actions align with your values and goals?,-
0,How do you support others in developing their assertiveness and confidence? Can you share an example of a time you've helped someone in this way?,-
0,Do you think there are situations where it might be more advantageous not to be assertive or confident? Why or why not?,-
0,How does your level of assertiveness and confidence affect your leadership style or ability to work within a team? What challenges and benefits have you experienced?,-
0,How do you see your assertiveness and confidence evolving in the future? Are there specific areas where you'd like to grow or change?,-
0,"How do you define flexibility and adaptability, and what distinguishes the two? Do you see them as separate skills or interconnected?",-
0,"Can you recall a specific situation where you had to demonstrate flexibility or adaptability? What were the challenges, and how did you overcome them?",-
0,How do you balance maintaining core values and goals with the need to be flexible and adaptable in various situations?,-
0,What strategies or practices do you use to cultivate flexibility and adaptability in your personal and professional life?,-
0,"Have you ever struggled with being too rigid or inflexible in a particular area? How did you recognize this, and what steps did you take to change?",-
0,How do you approach unexpected changes or disruptions? What role do flexibility and adaptability play in your response?,-
0,"In what ways has your ability to be flexible and adaptable affected your relationships, career, or personal growth? Can you share specific examples?",-
0,"How do cultural, social, or individual factors influence your ability or willingness to be flexible and adaptable? Have you noticed any biases or limitations?",-
0,"Do you believe that flexibility and adaptability are innate qualities, or can they be developed and strengthened? If the latter, how can someone work on these skills?",-
0,How do you maintain a sense of stability or control when continually adapting to new circumstances or challenges?,-
0,What role does continuous learning or staying updated with new information play in your ability to be flexible and adaptable?,-
0,How do you handle conflicts or differences in opinion that require flexibility in your approach or viewpoint? What strategies do you employ?,-
0,Can you think of a public figure or role model who exemplifies flexibility and adaptability? What lessons can be learned from their approach?,-
0,"Do you think there can be negative aspects to being overly flexible or adaptable? If so, what are they, and how can they be mitigated?",-
0,"How do you see the importance of flexibility and adaptability evolving in the future, particularly in the context of rapid technological changes, globalization, and societal shifts?",-
0,"How do you define risk-taking? Is it always related to physical or financial danger, or can it have other connotations for you?",-
0,"Can you describe a significant risk you've taken in your life? What motivated you to take that risk, and what were the outcomes?",-
0,"How do you evaluate whether a risk is worth taking? What factors do you consider, and how do you weigh them?",-
0,How does your personality influence your attitude towards risk-taking? Are there areas where you are more risk-averse or more risk-tolerant?,-
0,What role does fear play in your decision-making process when facing a risk? How do you manage or overcome that fear?,-
0,How has your attitude towards risk-taking changed over time? Were there specific experiences or people that influenced this change?,-
0,"Can you share an example of a risk that did not pay off? How did you handle the failure, and what did you learn from the experience?",-
0,"Do you believe that risk-taking can be a positive quality or a skill that can be developed? If so, how might someone work to cultivate this ability?",-
0,"How do you balance taking risks with maintaining responsibility to others, such as family, employees, or community?",-
0,What role does intuition or gut feeling play in your risk-taking decisions? Can you provide an example where this was particularly influential?,-
0,"How do cultural, social, or personal values influence your perception of and willingness to take risks? Have you noticed differences in various contexts or communities?",-
0,How does risk-taking relate to creativity or innovation in your personal or professional life? Can you share specific examples?,-
0,Do you have any role models or influential figures who embody a risk-taking spirit? What have you learned from their approach?,-
0,How do you mitigate or prepare for potential negative outcomes when taking a risk? What strategies or support systems do you rely on?,-
0,What philosophical questions or concepts intrigue you the most? Why do they resonate with you?,-
0,Do you align with any particular philosophical school of thought or tradition? How did you come to identify with it?,-
0,How do your philosophical beliefs influence your daily life and decision-making? Can you share specific examples?,-
0,What are your views on the nature of reality and existence? How do you reconcile the physical world with concepts of consciousness or spirituality?,-
0,What ethical principles guide your actions and judgments? How do you navigate moral dilemmas or conflicts between values?,-
0,"Do you believe in free will or determinism? How do these beliefs affect your understanding of responsibility, choice, and fate?",-
0,"What are your thoughts on the relationship between reason, emotion, and intuition? How do you balance these elements in your thinking and living?",-
0,"How do you approach the problem of uncertainty or the unknowable? What role does faith, skepticism, or agnosticism play in your worldview?",-
0,What does the concept of 'meaning' or 'purpose' mean to you? How have you sought or constructed meaning in your life?,-
0,How do you perceive the relationship between humans and nature? Does this perception influence your attitudes toward environmental stewardship or technology?,-
0,"Do you think that logic and reason are the only paths to truth, or do you value other ways of knowing? How do you reconcile potential conflicts between them?",-
0,"What are your views on justice, equality, and rights? How do these beliefs shape your political or social engagement?",-
0,"Do you believe that the self is a continuous, unified entity, or something more fragmented or fluid? How does this belief impact your sense of identity?",-
0,How do you approach disagreements or debates about deeply held philosophical beliefs? What methods do you use to understand or engage with differing perspectives?,-
0,"How have your philosophical beliefs evolved over time? Were there pivotal experiences, readings, or individuals that influenced these changes?",-
0,How do you define morality? What fundamental principles guide your moral compass?,-
0,"Do you believe that morality is universal, or does it vary between cultures and individuals? Why or why not?",-
0,"Can you share an example of a difficult moral decision you've faced? How did you navigate it, and what factors influenced your choice?",-
0,"What are your thoughts on moral obligations to others, such as family, community, or even strangers? How do you prioritize these obligations?",-
0,How do you approach moral dilemmas where there is a conflict between different ethical principles? Can you provide a specific scenario you've encountered?,-
0,"Do you think morality is innate or learned? How have your moral beliefs been shaped by upbringing, culture, religion, or personal experiences?",-
0,"What role do empathy, compassion, and reason play in your moral judgments? How do you balance these aspects when making decisions?",-
0,"How do you view the relationship between legality and morality? Are there instances where you believe something can be legal but immoral, or vice versa?",-
0,"Do you believe in absolute moral truths, or do you see morality as more situational and context-dependent? Why?",-
0,"What are your thoughts on the moral responsibility of corporations, governments, and other large entities? How do they align with individual morality?",-
0,How do you reconcile personal morality with societal norms or expectations that may conflict with your values? Can you share an example?,-
0,"Do you think technology and modern advancements pose new moral challenges? How do you navigate the ethics of issues like artificial intelligence, genetic engineering, or data privacy?",-
0,"What philosophers, authors, or thinkers have influenced your understanding of morality? How have their ideas resonated with or challenged your beliefs?",-
0,"How do you handle moral disagreements with close friends, family, or colleagues? What strategies do you use to find common ground or maintain respect?",-
0,"How has your moral perspective evolved over time, and what do you anticipate for your moral growth in the future? Are there areas where you are still questioning or exploring?",-
0,Can you share a pivotal life experience that fundamentally changed your perspective or direction? How did it affect you?,-
0,What's the most significant lesson you've learned from a failure or setback? How have you applied that lesson since?,-
0,"Have you ever taken a big risk or leap of faith? What motivated you, and what were the outcomes, whether positive or negative?",-
0,Can you describe a time when you had to adapt to a significant change or unexpected circumstance? What did you learn from that adaptation?,-
0,"What's a lesson you've learned from a relationship, whether it's a friendship, family, or romantic relationship? How has it influenced your subsequent interactions?",-
0,Is there a moment in your life when you felt truly proud of yourself? What did that experience teach you about your values or capabilities?,-
0,"Have you ever experienced a profound connection with a place, culture, or community different from your own? What insights did you gain?",-
0,"What's the most meaningful piece of advice you've received, and who gave it to you? How has it guided you through life?",-
0,Can you share a lesson learned from a seemingly insignificant or ordinary moment that had a lasting impact? What made it resonate with you?,-
0,How have your career or educational experiences shaped your character or life philosophy? What are some key takeaways?,-
0,"Is there an experience where you felt you genuinely made a difference in someone else's life? What did that teach you about empathy, compassion, or purpose?",-
0,"Have you ever faced a moral or ethical dilemma that challenged you? How did you resolve it, and what did you learn from the experience?",-
0,How has the way you deal with adversity or stress evolved over time? What experiences contributed to that evolution?,-
0,What are some misconceptions or prejudices you once held that were changed through personal experiences? How did those experiences alter your views?,-
0,"Looking back at your life's journey so far, what would you identify as the overarching themes or patterns? How do these reflect the lessons you've learned, and what do you hope to learn in the future?",-
0,"How do you define success in your life? Is it related to career, personal development, relationships, or something else?",-
0,Can you describe a moment in your life when you felt truly successful? What factors contributed to that feeling?,-
0,What do you believe are the most common misconceptions about success? How do your personal views differ from societal or cultural perceptions?,-
0,"How do you balance the pursuit of success with other important aspects of life, such as well-being, family, or personal growth?",-
0,Have you ever felt pressure to conform to others' definitions of success? How have you managed or responded to that pressure?,-
0,What role do failure and setbacks play in your understanding of success? Can you share an experience where a failure led to later success?,-
0,"Do you think success can be measured objectively, or is it a deeply personal and subjective experience? Why?",-
0,What values or principles guide you in your pursuit of success? How do they align with or differ from your broader moral or ethical beliefs?,-
0,How do you approach goal-setting and planning in your quest for success? What strategies or tools have you found most effective?,-
