recorded,question,answer
0,What is your perspective on forgiveness and its role in the process of conflict resolution?,-
0,Can you think of an instance where unresolved conflicts had a lasting impact on relationships or situations? What did you learn?,-
0,How do you handle conflicts in professional settings compared to personal ones? Are there any key differences in your approach?,-
0,"When facing a disagreement, how do you navigate the fine line between being assertive and being aggressive?",-
0,What are your thoughts on finding common ground in conflicts? How do you identify shared goals or interests?,-
0,Can you recall a situation where you were able to transform a negative conflict into a positive opportunity for growth?,-
0,"Reflecting on your experiences, how have your beliefs and approaches to conflict resolution evolved over time?",-
0,"What does ""community"" mean to you, and how has it shaped your sense of belonging and identity?",-
0,Can you share a specific experience that inspired you to become more actively involved in your community?,-
0,How do you balance your personal commitments with your desire to contribute to your community?,-
0,In what ways do you believe community involvement can positively impact individuals and the society as a whole?,-
0,Can you recall a project or initiative you were part of that had a meaningful impact on your community? What did you learn from it?,-
0,How do you identify areas within your community where your skills and passions can make a difference?,-
0,Are there specific social or environmental issues that resonate deeply with you and motivate your community engagement?,-
0,How do you overcome challenges or barriers when trying to engage others in community projects or activities?,-
0,Can you share a time when you had to collaborate with diverse groups of people within your community? What insights did you gain?,-
0,How do you stay motivated and sustain your commitment to community involvement over time?,-
0,What role do empathy and active listening play in fostering a strong sense of community and understanding among members?,-
0,Can you reflect on the balance between individual initiatives and collective efforts in creating a thriving community?,-
0,How does technology impact your approach to community involvement? How do you leverage digital platforms for positive change?,-
0,Can you think of a time when your perspective on a particular issue evolved due to your interactions within the community?,-
0,"How would you define ""cultural awareness,"" and why do you think it's important in today's globalized world?",-
0,"Can you share a moment when you became acutely aware of cultural differences, and how did it influence your perspective?",-
0,What steps do you take to educate yourself about cultures and traditions that are different from your own?,-
0,Can you reflect on a time when you had to confront your own biases or preconceptions about another culture?,-
0,"How do you navigate conversations about cultural differences, ensuring respect and understanding while addressing potential misunderstandings?",-
0,Can you share a story about a friendship or connection that significantly broadened your cultural horizons?,-
0,How do you balance the preservation of your own cultural heritage with the willingness to embrace new cultural experiences?,-
0,"What challenges do you believe society faces in promoting genuine cultural awareness, and how do you think they can be overcome?",-
0,"How does media influence your perception of different cultures, and how do you ensure a well-rounded understanding?",-
0,"Can you share a time when you engaged in cross-cultural collaboration, and what lessons did you learn from that experience?",-
0,"How do you define success in the context of your work and educational pursuits, and how has that definition evolved over time?",-
0,Can you recall a specific educational experience that significantly impacted your career path or approach to work?,-
0,What motivates you to pursue your current line of work or study? How do those motivations align with your values?,-
0,Can you reflect on a time when you faced a significant challenge at work or in your education? How did you overcome it?,-
0,How do you approach continuous learning and personal development within your chosen field?,-
0,Can you share a moment when you had to step out of your comfort zone to achieve a work or educational goal? What did you learn?,-
0,How do you view the balance between traditional education and practical experience when it comes to career advancement?,-
0,What role does mentorship and guidance play in your professional and educational journey?,-
0,Can you discuss a time when you had to make a difficult decision related to work or education? How did you approach it?,-
0,How do you manage work-life balance and prevent burnout while pursuing your career and educational goals?,-
0,Can you share an experience where collaboration with others led to a successful outcome at work or in your education?,-
0,How has technology impacted the way you approach work and education? What benefits and challenges do you see?,-
0,Can you discuss a time when you changed your career path or educational direction? What influenced that decision?,-
0,How do you view the intersection of passion and practicality when it comes to choosing a career or educational path?,-
0,"Looking ahead, what aspirations do you have for your work and education, and how do they align with your long-term goals?",-
0,"How do you envision success in your career, and how has that vision evolved over the years?",-
0,Can you recall a specific moment or experience that ignited your passion for your current career path?,-
0,What values do you believe are essential to align with in order to find fulfillment in your chosen career?,-
0,Can you discuss a time when you overcame self-doubt or obstacles to pursue a career aspiration? What motivated you?,-
0,How do you balance the pursuit of your personal interests and passions with the practical aspects of your career goals?,-
0,Can you share a story about a mentor or role model who influenced your career aspirations? What lessons did they impart?,-
0,"What steps do you take to continuously learn and grow within your field, and how do you remain adaptable to changes?",-
0,Can you reflect on a situation where you had to make a difficult decision related to your career path? How did you navigate it?,-
0,"How do you define ""meaningful work,"" and how does it shape your approach to your career goals and choices?",-
0,Can you discuss a time when you took a calculated risk to advance your career? What was the outcome?,-
0,How do you view the intersection between your career aspirations and your personal values and ethics?,-
0,What role does work-life balance play in your pursuit of career goals? How do you manage it effectively?,-
0,Can you share an instance where you had to adapt to unexpected changes or setbacks in your career journey?,-
0,How do you see your career contributing to your long-term life goals and overall sense of fulfillment?,-
0,"Looking ahead, what legacy or impact do you hope to create through your career, and how do your current goals align with that vision?",-
0,How would you describe the role that education has played in shaping who you are today?,-
0,Can you recall a specific teacher or educational experience that significantly impacted your perspective on learning?,-
0,What motivated you to pursue the field of study you chose? How does it reflect your interests and aspirations?,-
0,Can you discuss a time when you faced challenges or setbacks in your educational journey? How did you overcome them?,-
0,How do you view the balance between formal education and self-directed learning in your personal growth?,-
0,Can you share a moment when a particular course or subject opened your eyes to a new way of thinking or understanding?,-
0,What role does curiosity play in your approach to learning? How do you nurture and sustain it?,-
0,Can you reflect on the ways your educational background has influenced your career choices and professional growth?,-
0,How do you apply the skills and knowledge you gained during your education to your everyday life?,-
0,Can you discuss an experience where collaboration with peers in an educational setting led to deeper insights or personal growth?,-
0,How do cultural or societal influences impact the way you perceive education and the value you place on it?,-
0,Can you share an instance when you explored a topic or subject outside of your formal education that deeply interested you?,-
0,How has your educational journey contributed to your ability to adapt and thrive in different situations?,-
0,Can you discuss a time when you had to step out of your comfort zone to pursue an educational opportunity? What did you learn?,-
0,"Looking ahead, how do you see your educational background continuing to shape your personal and professional growth?",-
0,"How do you define ""work ethic,"" and what values or principles do you associate with it?",-
0,Can you recall a specific experience from your past that shaped your approach to work and instilled a strong work ethic?,-
0,How do you view the balance between working hard and working smart? How do these concepts intersect for you?,-
0,Can you share an instance when you went above and beyond your regular duties due to your strong work ethic? What motivated you?,-
0,What strategies or practices do you use to maintain your focus and productivity even when faced with challenges?,-
0,How do you approach tasks that are not aligned with your strengths or interests while maintaining your work ethic?,-
0,Can you discuss a time when you had to make a difficult choice related to work ethics and integrity? How did you handle it?,-
0,How do you view the connection between work ethic and personal satisfaction or sense of accomplishment?,-
0,Can you share an experience when your work ethic enabled you to overcome obstacles and achieve a significant goal?,-
0,"What role does perseverance play in your work ethic, and how do you stay committed in the face of setbacks?",-
0,Can you reflect on a time when you had to balance your strong work ethic with the need to prioritize self-care and well-being?,-
0,How do you adapt your work ethic to collaborative projects or team environments?,-
0,Can you discuss the influence of role models or mentors on your understanding and development of a strong work ethic?,-
0,How do cultural or societal factors impact the way you perceive and practice work ethic?,-
0,"Looking ahead, how do you see your work ethic continuing to shape your personal and professional growth?",-
0,"How do you define effective leadership, and what qualities do you believe make a great leader?",-
0,"Can you share an experience when you took on a leadership role? What challenges did you face, and how did you overcome them?",-
0,How do you approach leading a team while fostering a collaborative and inclusive environment?,-
0,Can you discuss a time when you had to follow someone else's leadership? What did you learn from that experience?,-
0,What role do empathy and active listening play in effective leadership and teamwork?,-
0,Can you share a story about a memorable team project? How did your leadership style contribute to its success?,-
0,How do you navigate conflicts or disagreements within a team while maintaining a positive and productive atmosphere?,-
0,Can you reflect on the balance between providing clear direction and allowing team members the autonomy to contribute their ideas?,-
0,How do cultural or individual differences impact your approach to leading diverse teams?,-
0,Can you discuss an instance when you had to step back and allow someone else's leadership to take precedence? What insights did you gain?,-
0,How do you view the connection between personal growth and leadership development? How have they influenced each other for you?,-
0,Can you share an experience when you had to lead a team through a challenging situation or crisis? How did you manage it?,-
0,"How does your leadership style adapt to different types of projects, tasks, or team dynamics?",-
0,Can you discuss the influence of role models or mentors on your understanding and development of leadership skills?,-
0,"Looking ahead, how do you see your leadership skills continuing to shape your personal and professional growth?",-
0,"How do you define ""work-life balance,"" and what does it mean to you in your current stage of life?",-
0,Can you recall a specific instance when you felt a lack of balance between your work and personal life? What did you learn from it?,-
0,What strategies or practices do you implement to prioritize self-care and maintain a healthy work-life balance?,-
0,Can you discuss a time when you had to set boundaries between work and personal commitments? How did you communicate them?,-
0,How do you manage your energy levels and prevent burnout while juggling professional and personal responsibilities?,-
0,Can you share a story about a time when you successfully integrated your personal interests or passions into your work routine?,-
0,How do you approach time management to ensure you dedicate enough time to both work and personal activities?,-
0,"Can you reflect on the role that technology plays in your work-life balance, and how do you manage its impact?",-
0,How do your beliefs and cultural background influence your perspective on work-life balance?,-
0,Can you discuss an instance when you made a deliberate choice to prioritize one area of your life over the other? How did you decide?,-
0,How does your approach to work-life balance evolve during periods of high stress or increased workload?,-
0,Can you share an experience when you received support or guidance from someone else to improve your work-life balance?,-
0,How do you view the long-term implications of maintaining a healthy work-life balance on your overall well-being?,-
0,Can you discuss the influence of role models or mentors on your understanding and pursuit of work-life balance?,-
0,"Looking ahead, how do you envision your ideal work-life balance and the steps you plan to take to achieve it?",-
0,"What does ""lifelong learning"" mean to you, and how does it align with your personal values and aspirations?",-
0,Can you share a memorable instance when you pursued learning beyond formal education? What motivated you?,-
0,How do you integrate curiosity and a thirst for knowledge into your daily life and routines?,-
0,Can you discuss a time when you stepped out of your comfort zone to explore a new subject or skill? What did you discover?,-
0,"What role does technology play in your approach to continuous learning, and how do you navigate information overload?",-
0,Can you reflect on a period of personal growth that was driven by your commitment to lifelong learning?,-
0,"How do you choose which topics or areas to delve into for further learning, and what guides your selection?",-
0,Can you share a story about a mentor or role model who inspired you to value and pursue lifelong learning?,-
0,How does your cultural background or upbringing influence your attitude towards learning and personal development?,-
0,Can you discuss an experience when you had to unlearn or reevaluate a belief due to new knowledge gained through lifelong learning?,-
0,How do you find a balance between structured learning approaches and self-directed exploration?,-
0,Can you reflect on the connection between lifelong learning and adaptability in an ever-changing world?,-
0,How does the pursuit of lifelong learning contribute to your overall sense of purpose and fulfillment?,-
0,Can you share a time when you encountered challenges or barriers in your quest for continuous learning? How did you overcome them?,-
0,"Looking ahead, what areas of knowledge or skills do you hope to continue exploring throughout your life?",-
0,"How do you define ""health"" and ""well-being,"" and how do these concepts interplay in your life?",-
0,Can you share an experience that made you realize the importance of prioritizing your physical and mental well-being?,-
0,What practices or rituals do you incorporate into your daily routine to maintain your overall health?,-
0,Can you discuss a time when you faced challenges to your health or well-being and how you navigated them?,-
0,"How do you approach finding a balance between physical health, mental health, and emotional well-being?",-
0,Can you reflect on your relationship with self-care and how it contributes to your overall sense of well-being?,-
0,What role does nutrition and exercise play in your approach to maintaining a healthy lifestyle?,-
0,Can you share a story about a time when you supported someone else in their journey to better health and well-being?,-
0,How do you manage stress and cultivate resilience in the face of life's challenges?,-
0,Can you discuss an instance when you took a proactive step to improve an aspect of your health or well-being? What was the result?,-
0,How do cultural or societal factors influence your perspective on health and the choices you make?,-
0,Can you reflect on the connection between your mental and emotional well-being and your overall quality of life?,-
0,How do you view the relationship between solitude and social connections in maintaining well-being?,-
0,Can you share a time when you learned a valuable lesson about health and well-being through personal experience?,-
0,"Looking ahead, how do you envision your approach to health and well-being evolving as you continue to grow?",-
0,How do you perceive the relationship between physical health and overall well-being in your life?,-
0,Can you share an experience that influenced your understanding of the importance of maintaining good physical health?,-
0,What habits or routines do you practice to support your physical health and well-being on a daily basis?,-
0,Can you discuss a time when you faced challenges to your physical health and how you overcame them?,-
0,How do you balance striving for physical health with embracing body positivity and self-acceptance?,-
0,Can you reflect on your approach to exercise and its impact on both your physical and mental well-being?,-
0,"What role does nutrition play in your daily life, and how do your dietary choices reflect your values and beliefs?",-
0,Can you share a story about a time when you motivated someone else to prioritize their physical health?,-
0,How do you manage stress and incorporate relaxation practices into your routine to support physical well-being?,-
0,Can you discuss an instance when you had to make a conscious effort to break a negative health-related habit? What was the outcome?,-
0,How does your cultural background or societal influences impact your perspective on physical health and wellness?,-
0,Can you reflect on the relationship between physical health and your ability to achieve your goals and pursue your passions?,-
0,How do you view the connection between sleep quality and overall physical well-being?,-
0,Can you share a time when you made a significant lifestyle change to improve your physical health? What did you learn?,-
0,"Looking ahead, how do you see your approach to physical health evolving as you continue to grow and age?",-
0,How do you define mental well-being? What aspects of your life contribute to or hinder your mental health?,-
0,"Can you recall a time when you've faced mental health challenges? How did you handle it, and what did you learn from the experience?",-
0,How do societal perceptions of mental health affect your views and attitudes towards it? Have you noticed any shifts in these perceptions during your lifetime?,-
0,"What is your opinion on seeking professional help for mental health issues? Have you or anyone close to you sought therapy or counseling, and if so, what was the experience like?",-
0,How do you differentiate between the mind and the body in the context of health? How do you see their connection or separation affecting your overall well-being?,-
0,"What are your beliefs about the influence of genetics, environment, and personal choice on mental health? How do these factors interplay in shaping mental well-being?",-
0,"How do you approach the topic of mental health with friends and family? Is it something you feel comfortable discussing openly, or is it a more private matter?",-
0,In what ways do you believe your culture or background has shaped your understanding and approach to mental health?,-
0,How do you practice self-care to maintain or improve your mental well-being? Are there any specific strategies or rituals that you find effective?,-
0,What are your thoughts on the stigmas that often surround mental health? How have these stigmas affected your own perceptions or the perceptions of those around you?,-
0,"How do you perceive the relationship between creativity, intelligence, and mental health? Is there a balance that must be struck, or are these aspects inherently connected?",-
0,"What role do you think schools, workplaces, and other institutions should play in promoting and supporting mental health?",-
0,"How has the digital age, social media, and technology influenced your mental well-being, and what are your thoughts on their overall impact on society's mental health?",-
0,"In what ways do you think public policy should address mental health? What changes would you like to see in mental health care accessibility, awareness, and support?",-
0,"If you could give advice to someone struggling with mental health, based on your own beliefs and experiences, what would that advice be?",-
0,How do you define spirituality? What distinguishes spiritual beliefs and practices from other aspects of life for you?,-
0,"Can you describe your spiritual journey? How has it evolved over time, and what have been the major influences or turning points?",-
0,"What spiritual practices, rituals, or traditions are most meaningful to you? How do you incorporate them into your daily life?",-
0,How do your spiritual beliefs connect with your understanding of morality and ethics? Do they guide your decision-making and behavior?,-
0,"Are there any specific texts, philosophies, or religious figures that have particularly influenced your spiritual beliefs and practices? If so, how?",-
0,"How do you reconcile your spiritual beliefs with scientific understanding, reason, and logic? Is there ever a conflict, and if so, how do you navigate it?",-
0,"How do your spiritual beliefs impact your relationships with others, both within and outside of your spiritual community?",-
0,"Have you ever experienced what you would describe as a spiritual or transcendent moment? What was that like, and how did it affect your beliefs or practices?",-
0,"In what ways do your spiritual beliefs provide comfort, guidance, or purpose in times of stress, grief, or uncertainty?",-
0,How do you approach the topic of spirituality with people who hold different beliefs? What is important to you in interfaith or inter-spiritual dialogues?,-
0,"How do you view the concept of the divine, higher power, or universal energy, if at all, within your spiritual framework?",-
0,How do your spiritual beliefs align with or differ from the cultural or religious traditions you were raised in? How have you navigated any tensions or contradictions?,-
0,"What role do you think spiritual beliefs and practices should have in education, politics, or other public domains?",-
0,"How does your spirituality connect with your views on environmental stewardship, social justice, and community service?",-
0,"If you could share one core insight or lesson from your spiritual beliefs and practices with someone else, what would it be and why?",-
0,What hobbies do you engage in that bring you a sense of relaxation and joy? How did you discover these hobbies?,-
0,How do your hobbies reflect your personality and values? Do you see a connection between your interests and who you are as a person?,-
0,Have you ever used hobbies as a means of coping with stress or difficult life events? What impact did they have on your well-being during those times?,-
0,How do you balance your hobbies with other responsibilities and commitments in your life? Have you ever found it challenging to make time for them?,-
0,Do you prefer hobbies that you can do alone or ones that involve social interaction? How does this preference align with other aspects of your personality?,-
0,How do you feel when you are engaged in your favorite hobbies? Can you describe the mental or emotional state you reach while partaking in these activities?,-
0,"Have your hobbies evolved over time, reflecting changes in your life or personal growth? Can you provide examples of how this has occurred?",-
0,"How do you explore and adopt new hobbies? What attracts you to trying something new, and what barriers, if any, do you face in doing so?",-
0,What role do you think hobbies and leisure activities should play in a balanced life? How do you approach finding that balance for yourself?,-
0,"How do your hobbies connect with your broader life goals or sense of purpose? Do you see them as purely recreational, or do they serve a deeper meaning for you?",-
0,"Have you ever shared a hobby with someone close to you, such as a friend or family member? What was that experience like, and how did it affect your relationship?",-
0,"Do you believe that hobbies can contribute to personal growth and self-discovery? If so, how have your hobbies contributed to your own personal development?",-
0,How do you feel when you are unable to engage in your hobbies for an extended period? What strategies do you employ to deal with those feelings?,-
0,"Have you ever turned a hobby into a career or a source of income? What was that transition like, and how did it affect your relationship with the hobby?",-
